SeqNo,text,hashtags,comments,likes
0,"Meant to add this to last post! Honestly, just read everything Rebecca writes. It will always make you think more and more carefully! 
#RebeccaSolnit #MenCallMeThings #callthembytheirtruenames #ragebecomesher #bookrecommendations",mencallmethings,"|That woman in front could be my sister,  we look so similar.... such a funny sensation to see your twin....I need to meet her|No one gives a fuck u none human lesbian",45
1,"SAP 13
Men Call Me Things: It’s Not as Romantic as It Sounds

Twitter memiliki sisi baik dan buruk, tetapi lebih banyak baiknya. Misalnya bisa berkumpul dengan banyak orang yang memiliki sudut pandang sama dan membaca konten-konten yang menarik dari orang lain, di mana dahulu kita belum bisa lakukan. Di Twitter, seakan-akan hiduplah suatu dunia kecil yang terpersonalisasi, di mana setiap orang memiliki dunia mereka-masing.

Tetapi sayangnya, di internet juga bisa terbentuk sentimen massa, seperti misogini. Trolling sudah ada sejak era MySpace dan GeoCities, tetapi fenomena misogini secara digital yang bersifat anonim terus terjadi. seperti berupa ancaman terhadap wanita secara daring. Misalnya, ancaman kematian, ancaman pemerkosaan, kekerasan, dan seksisme yang dianggap wajar oleh beberapa pria.

Trolling seksisme pernah terjadi pada Julia Gillard, Miranda Divine, Catherine Deveny, dan Marieke Hardy. Hal ini juga dirasakan oleh Karalee Evans, di mana ia dilecehkan melalui pesan di surelnya, di mana ada beberapa laki-laki yang menggodanya dengan panggilan “love”, meremehkannya untuk kembali bekerja di dapur, dan ada pula yang mengatakan jika dunia akan menjadi lebih baik tanpanya. Sayangnya, sekitar 9 dari 10 orang yang melakukan trolling terhadapnya tidak menggunakan identitas diri mereka, melainkan berupa anonim. Hal ini terjadi karena mereka kurang percaya diri, takut terhadap keamanan diri, dan takut mengganggu kredibilitasnya. Ini pula yang menjadi tameng bagi mereka sehingga bisa melakukan seksisme secara daring.

Tidak banyak orang yang berani untuk menentang sentimen seksime lelaki secara daring. Oleh karena itu, kesetaraan untuk wanita perlu untuk diperjuangkan karena trolling dalam bentuk seksisme ini tidaklah adil dan harus diselesaikan. Selama ini, jika perempuan merespon trolling yang dilakukan oleh pria, wanita akan dilihat terlalu membawa perasaan dan terlalu sensitif. Bahkan tidak jarang muncul perkataan “Makanya, nggak usah main media sosial”, baik dari mulut laki-laki maupun dari wanita.
#spik600087",mencallmethings,"|Salah satu aksi yang pernah dilakukan untuk melawan trolling seksisme adalah melalui penggunaan #mencallmethings di Twitter, di mana perempuan mengungkapkan pengalamannya dan menyebutkan siapa pelakunya yang bertujuan untuk mempermalukan si pria. Gerakan ini diawali oleh Sady Foyle. Karena sesungguhnya, setiap orang memiliki bertanggung jawab atas perilaku mereka sendiri di dunia daring dan mereka harus berperilaku sesuai dengan netiquette.
Referensi:
Evans, Karalee. (2011). “Men Call Me Things: It’s Not as Romantic as It Sounds”. ABC News. http://www.abc.net.au/news/2011-11-11/evans-men-call-me-things-and-its-not-romantic-twitt/3659712, diunduh pada 1 Mei 2018.",0
2,#mencallmethings creepy tv,mencallmethings,|@hsmi6377 @lyndalphotos,3
3,So the couch of shame has been added to today... #mencallmethings #thesispanic,mencallmethings,|nice cushion :)|@jaeheepark you'll be pleased to know I didn't write obscene things on it,4
4,"Hey #thesispanic followers, remember when I decided to build a wall out of polystyrene? Well there you go... #mencallmethings",mencallmethings,|This looks pretty damn realistic!,10
